{
  "plan_id": "multi-agent-dispatch-plan-a1",
  "generated_at": "2026-06-13T06:01:10.316544Z",
  "status": "HUMAN_REQUIRED",
  "executed_external_runtime": false,
  "source_preflight": {
    "path": "_reports\\multi-agent-gate0-preflight-a1\\PREFLIGHT_CURRENT.json",
    "sha256": "a85530faba20a23e050e0f6702cccd622513bc8590ed51bc60e26c661f448b5f",
    "generated_at": "2026-06-13T06:01:10.098730Z",
    "overall": "HUMAN_REQUIRED",
    "human_gate_required": true,
    "executed_external_runtime": false,
    "detail": "Loaded Gate 0 preflight artifact."
  },
  "conflict_summary": {
    "has_write_conflicts": false,
    "has_errors": false,
    "errors": [],
    "parallel_group_count": 1,
    "compared_write_pairs": [
      [
        "_reports/multi-agent-architecture-review-a1/ARCHITECTURE_REVIEW.md",
        "_reports/multi-agent-verifier-a1/VERIFY_REPORT.md"
      ],
      [
        "_reports/multi-agent-architecture-review-a1/ARCHITECTURE_REVIEW.md",
        "_reports/multi-agent-quality-review-a1/QUALITY_REVIEW.md"
      ],
      [
        "_reports/multi-agent-verifier-a1/VERIFY_REPORT.md",
        "_reports/multi-agent-quality-review-a1/QUALITY_REVIEW.md"
      ]
    ]
  },
  "assignments": [
    {
      "worker_role": "Architecture-Reviewer",
      "parallel_group_id": "local-readiness",
      "parallel_safe": true,
      "project_module": "multi-agent pilot architecture",
      "target": "Confirm dispatch boundaries and runtime scope before any execution.",
      "why_big_module": "Architecture gating prevents parallel work from crossing runtime, paper, or governance boundaries.",
      "allowed_modify_range": [
        "_reports/multi-agent-architecture-review-a1/"
      ],
      "forbidden_modify_range": [
        "scripts/",
        ".agent/",
        "docs/agent-runtime/",
        "paper workflow code"
      ],
      "depends_on_interface_contracts": [
        "schemas/agent-runtime/task-spec.schema.json",
        "schemas/agent-runtime/multi-agent-gate0-preflight.schema.json"
      ],
      "provides_interface_contracts": [
        "Worker final report format from active objective",
        "TaskSpec conflict_registry write_set/read_set"
      ],
      "main_flow_to_connect": "Gate 0 preflight -> dispatch plan -> reviewer-safe task pool.",
      "real_functionality_required": "Produce real local evidence, not mock completion or verbal readiness.",
      "tests_or_probes_required": [
        "read-only report plus cited file/line evidence"
      ],
      "required_verification_commands": [
        "read-only report plus cited file/line evidence"
      ],
      "quality_standard": "P0/P1 zero; P2 documented with evidence; no external runtime execution.",
      "completion_standard": "Report includes verdict, changed files, tests run, artifacts, known gaps, and suggested review focus.",
      "blocking_conditions": [
        "Finds P0/P1 architecture issue",
        "Needs external runtime execution"
      ],
      "governance_record_requirements": [
        "Report path must be referenced by Integrator before governance docs change."
      ],
      "task_spec": {
        "task_id": "ma-architecture-review-a1",
        "title": "Review multi-agent architecture boundaries",
        "priority": "P2",
        "status": "ready",
        "description": "Check module boundaries, interface contracts, and forbidden cross-runtime execution paths before dispatch.",
        "depends_on": [],
        "assumptions": [
          "Current Gate 0 preflight may remain HUMAN_REQUIRED.",
          "Worker must not execute opencode, live CDP, cross-repo smoke, or paper workflow without separate human authorization."
        ],
        "risk_notes": "No external runtime execution is authorized by this TaskSpec.",
        "estimated_tools": [
          "rg",
          "python",
          "pytest"
        ],
        "gate_0": {
          "triggered": true,
          "trigger_reason": "Multi-agent dispatch plan introduces executable worker boundaries.",
          "inventory_evidence": {
            "queried_sources": [
              "docs/agent-runtime/sub-agent-dispatch-protocol.md",
              "docs/agent-runtime/capability-inventory.md",
              "docs/MULTI_AGENT_MULTI_GPT_PILOT_PLAN.md",
              "schemas/agent-runtime/task-spec.schema.json"
            ],
            "matched_capabilities": [
              "CAP-029 dev-frame-opencode Dispatch",
              "SADP TaskSpec conflict_registry",
              "multi-agent-gate0-preflight"
            ],
            "compared_against_request": [
              "parallel worker dispatch",
              "exclusive write boundaries",
              "human-gated external runtime execution"
            ]
          },
          "rules_checked": [
            "core-001",
            "core-005",
            "core-007",
            "review-001"
          ],
          "lessons_checked": [
            "LL-structured-task-spec",
            "LL-independent-review-evidence"
          ],
          "sufficiency_decision": "existing_partial",
          "decision": "build_delta",
          "delta_justification": "Existing TaskSpec covers per-task boundaries, but the pilot needs a batch-level assignment packet and conflict check before human-gated dispatch."
        },
        "conflict_registry": {
          "read_set": [
            "docs/MULTI_AGENT_MULTI_GPT_PILOT_PLAN.md",
            "docs/governance/HANDOFF.md",
            "docs/governance/RISK_REGISTER.md"
          ],
          "write_set": [
            "_reports/multi-agent-architecture-review-a1/ARCHITECTURE_REVIEW.md"
          ],
          "protected_files_touched": false,
          "conflict_level": "none"
        },
        "security_report": {
          "scan_status": "not_run",
          "new_external_api": false,
          "env_example_placeholders_only": null,
          "real_key_patterns_found": null,
          "staged_diff_secret_scan_run": false,
          "key_rotation_needed": null
        }
      }
    },
    {
      "worker_role": "Verifier",
      "parallel_group_id": "local-readiness",
      "parallel_safe": true,
      "project_module": "multi-agent local verification",
      "target": "Run the narrow local checks that prove current readiness state.",
      "why_big_module": "Verification is the evidence source for deciding whether HUMAN_REQUIRED is the only remaining gate.",
      "allowed_modify_range": [
        "_reports/multi-agent-verifier-a1/"
      ],
      "forbidden_modify_range": [
        "scripts/",
        "tests/",
        ".agent/",
        "docs/"
      ],
      "depends_on_interface_contracts": [
        "schemas/agent-runtime/task-spec.schema.json",
        "schemas/agent-runtime/multi-agent-gate0-preflight.schema.json"
      ],
      "provides_interface_contracts": [
        "Worker final report format from active objective",
        "TaskSpec conflict_registry write_set/read_set"
      ],
      "main_flow_to_connect": "Registry validation -> Gate 0 preflight -> execution guard tests.",
      "real_functionality_required": "Produce real local evidence, not mock completion or verbal readiness.",
      "tests_or_probes_required": [
        "python -m pytest tests\\test_multi_agent_gate0_preflight.py tests\\test_conversation_registry.py tests\\test_cross_repo_execution_guards.py tests\\test_smoke_suite.py -q",
        "python scripts\\multi_agent_gate0_preflight.py --output _reports\\multi-agent-gate0-preflight-a1\\GATE0_PREFLIGHT.json"
      ],
      "required_verification_commands": [
        "python -m pytest tests\\test_multi_agent_gate0_preflight.py tests\\test_conversation_registry.py tests\\test_cross_repo_execution_guards.py tests\\test_smoke_suite.py -q",
        "python scripts\\multi_agent_gate0_preflight.py --output _reports\\multi-agent-gate0-preflight-a1\\GATE0_PREFLIGHT.json"
      ],
      "quality_standard": "P0/P1 zero; P2 documented with evidence; no external runtime execution.",
      "completion_standard": "Report includes verdict, changed files, tests run, artifacts, known gaps, and suggested review focus.",
      "blocking_conditions": [
        "Local tests fail",
        "CLI executes an external runtime",
        "Output omits HUMAN_REQUIRED details"
      ],
      "governance_record_requirements": [
        "Verifier report must include command, exit code, and output summary."
      ],
      "task_spec": {
        "task_id": "ma-verifier-a1",
        "title": "Run local multi-agent governance verification",
        "priority": "P2",
        "status": "ready",
        "description": "Independently run local-only tests and CLI probes for Gate 0, registry, and execution guards.",
        "depends_on": [],
        "assumptions": [
          "Current Gate 0 preflight may remain HUMAN_REQUIRED.",
          "Worker must not execute opencode, live CDP, cross-repo smoke, or paper workflow without separate human authorization."
        ],
        "risk_notes": "No external runtime execution is authorized by this TaskSpec.",
        "estimated_tools": [
          "rg",
          "python",
          "pytest"
        ],
        "gate_0": {
          "triggered": true,
          "trigger_reason": "Multi-agent dispatch plan introduces executable worker boundaries.",
          "inventory_evidence": {
            "queried_sources": [
              "docs/agent-runtime/sub-agent-dispatch-protocol.md",
              "docs/agent-runtime/capability-inventory.md",
              "docs/MULTI_AGENT_MULTI_GPT_PILOT_PLAN.md",
              "schemas/agent-runtime/task-spec.schema.json"
            ],
            "matched_capabilities": [
              "CAP-029 dev-frame-opencode Dispatch",
              "SADP TaskSpec conflict_registry",
              "multi-agent-gate0-preflight"
            ],
            "compared_against_request": [
              "parallel worker dispatch",
              "exclusive write boundaries",
              "human-gated external runtime execution"